{
  "$schema": "https://www.truzme.com/schemas/project-code/v1.json",
  "units": {
    "length": "ft",
    "sectionLength": "in",
    "force": "kip",
    "materialStrength": "ksi",
    "area": "in²",
    "density": "lb/ft³"
  },
  "nodes": [
    { "id": 1, "x": 0, "y": 0 },
    { "id": 2, "x": 12, "y": 0 },
    { "id": 3, "x": 6, "y": 8 }
  ],
  "members": [
    { "id": 1, "from": 1, "to": 2, "section": 1, "material": 1 },
    { "id": 2, "from": 1, "to": 3, "section": 1, "material": 1 },
    { "id": 3, "from": 2, "to": 3, "section": 1, "material": 1 }
  ],
  "supports": [
    { "id": 1, "node": 1, "x": true, "y": true },
    { "id": 2, "node": 2, "x": false, "y": true }
  ],
  "nodalLoads": [
    { "id": 1, "node": 3, "x": 0, "y": -2 }
  ],
  "materials": [
    { "id": 1, "name": "A36 steel", "EModulus": 29000, "fMax": 36, "density": 490 }
  ],
  "sections": [
    { "id": 1, "name": "HSS 4×4×1/4", "sectionType": "hollow_rectangle", "w": 4, "h": 4, "thickness": 0.25 }
  ]
}
